{
  "schemaVersion": 1,
  "snapshotDate": "2026-09-20",
  "patch": "2026-09-17-a-study-in-gray",
  "region": "asia",
  "source": {
    "type": "unofficial-current-roster",
    "url": "https://starsavior-db.pages.dev/saviors/",
    "sourceCount": 55,
    "verifiedInAsiaClient": false,
    "statsContext": "source-table-base-stats"
  },
  "characters": [
    { "id": "asherah-voyager-savior-party", "name": "Asherah", "title": "Voyager Savior Party", "rarity": "SSR", "element": "moon", "class": "striker", "stats": { "hp": 4080, "attack": 1023, "defense": 195, "speed": 100, "criticalHitRate": 14, "criticalDamage": 68, "effectHit": 100, "effectResistance": 0 }, "verification": "observed-public" },
    { "id": "smile-voyager-savior-party", "name": "Smile", "title": "Voyager Savior Party", "rarity": "SSR", "element": "star", "class": "ranger", "stats": { "hp": 4325, "attack": 1023, "defense": 195, "speed": 100, "criticalHitRate": 5, "criticalDamage": 50, "effectHit": 112, "effectResistance": 0 }, "verification": "observed-public" },
    { "id": "luna-voyager-savior-party", "name": "Luna", "title": "Voyager Savior Party", "rarity": "SSR", "element": "order", "class": "caster", "stats": { "hp": 4045, "attack": 1103, "defense": 191, "speed": 93, "criticalHitRate": 14, "criticalDamage": 68, "effectHit": 100, "effectResistance": 0 }, "verification": "observed-public" },
    { "id": "carnelia", "name": "Carnelia", "title": "Wanderer", "rarity": "SSR", "element": "chaos", "class": "caster", "stats": { "hp": 4045, "attack": 1166, "defense": 191, "speed": 93, "criticalHitRate": 14, "criticalDamage": 50, "effectHit": 100, "effectResistance": 0 }, "verification": "observed-public" },
    { "id": "bell", "name": "Bell", "title": "Candle Square", "rarity": "SSR", "element": "star", "class": "ranger", "stats": { "hp": 4080, "attack": 966, "defense": 195, "speed": 112, "criticalHitRate": 5, "criticalDamage": 50, "effectHit": 112, "effectResistance": 0 }, "verification": "observed-public" },
    { "id": "emily", "name": "Emily", "title": "Candle Square", "rarity": "SSR", "element": "moon", "class": "defender", "stats": { "hp": 5559, "attack": 600, "defense": 245, "speed": 95, "criticalHitRate": 14, "criticalDamage": 68, "effectHit": 100, "effectResistance": 0 }, "verification": "observed-public" },
    { "id": "charlotte-monastir-knights", "name": "Charlotte", "title": "Monastir Knights", "rarity": "SSR", "element": "sun", "class": "striker", "stats": { "hp": 4325, "attack": 1043, "defense": 195, "speed": 104, "criticalHitRate": 5, "criticalDamage": 50, "effectHit": 100, "effectResistance": 0 }, "verification": "observed-public" },
    { "id": "carmen-monastir-knights", "name": "Carmen", "title": "Monastir Knights", "rarity": "SSR", "element": "moon", "class": "defender", "stats": { "hp": 5664, "attack": 600, "defense": 260, "speed": 95, "criticalHitRate": 5, "criticalDamage": 50, "effectHit": 100, "effectResistance": 8 }, "verification": "observed-public" },
    { "id": "frey-monastir-knights", "name": "Frey", "title": "Monastir Knights", "rarity": "SSR", "element": "star", "class": "supporter", "stats": { "hp": 5664, "attack": 600, "defense": 260, "speed": 95, "criticalHitRate": 5, "criticalDamage": 50, "effectHit": 100, "effectResistance": 8 }, "verification": "observed-public" },
    { "id": "seira", "name": "Seira", "title": "Nightmare", "rarity": "SSR", "element": "order", "class": "striker", "stats": { "hp": 4473, "attack": 1074, "defense": 196, "speed": 107, "criticalHitRate": 5, "criticalDamage": 50, "effectHit": 100, "effectResistance": 0 }, "verification": "observed-public" },
    { "id": "trish", "name": "Trish", "title": "Aselus Association", "rarity": "SSR", "element": "star", "class": "assassin", "stats": { "hp": 3920, "attack": 933, "defense": 190, "speed": 90, "criticalHitRate": 14, "criticalDamage": 75, "effectHit": 100, "effectResistance": 12 }, "verification": "observed-public" },
    { "id": "lyn", "name": "Lyn", "title": "Wind Moon Sect", "rarity": "SSR", "element": "star", "class": "striker", "stats": { "hp": 4325, "attack": 1023, "defense": 195, "speed": 106, "criticalHitRate": 5, "criticalDamage": 50, "effectHit": 100, "effectResistance": 0 }, "verification": "observed-public" },
    { "id": "cristelle", "name": "Cristelle", "title": "Morrel Ocean Traders", "rarity": "SSR", "element": "sun", "class": "ranger", "stats": { "hp": 4080, "attack": 1043, "defense": 195, "speed": 100, "criticalHitRate": 11, "criticalDamage": 50, "effectHit": 112, "effectResistance": 0 }, "verification": "observed-public" },
    { "id": "haydee", "name": "Haydee", "title": "Morrel Ocean Traders", "rarity": "SSR", "element": "star", "class": "defender", "stats": { "hp": 4834, "attack": 600, "defense": 299, "speed": 95, "criticalHitRate": 5, "criticalDamage": 50, "effectHit": 100, "effectResistance": 12 }, "verification": "observed-public" },
    { "id": "serpang", "name": "Serpang", "title": "Wind Moon Sect", "rarity": "SSR", "element": "sun", "class": "supporter", "stats": { "hp": 5559, "attack": 600, "defense": 245, "speed": 95, "criticalHitRate": 5, "criticalDamage": 50, "effectHit": 112, "effectResistance": 12 }, "verification": "observed-public" },
    { "id": "dana", "name": "Dana", "title": "Canopus Rangers", "rarity": "SSR", "element": "star", "class": "caster", "stats": { "hp": 3920, "attack": 1073, "defense": 190, "speed": 90, "criticalHitRate": 14, "criticalDamage": 68, "effectHit": 100, "effectResistance": 0 }, "verification": "observed-public" },
    { "id": "muriel", "name": "Muriel", "title": "Monolith Order", "rarity": "SSR", "element": "sun", "class": "caster", "stats": { "hp": 4077, "attack": 933, "defense": 190, "speed": 90, "criticalHitRate": 5, "criticalDamage": 75, "effectHit": 116, "effectResistance": 0 }, "verification": "observed-public" },
    { "id": "elisa", "name": "Elisa", "title": "Monolith Order", "rarity": "SSR", "element": "chaos", "class": "supporter", "stats": { "hp": 5894, "attack": 615, "defense": 262, "speed": 98, "criticalHitRate": 5, "criticalDamage": 50, "effectHit": 100, "effectResistance": 8 }, "verification": "observed-public" },
    { "id": "tyria", "name": "Tyria", "title": "Executor", "rarity": "SSR", "element": "sun", "class": "striker", "stats": { "hp": 4325, "attack": 1082, "defense": 195, "speed": 100, "criticalHitRate": 5, "criticalDamage": 50, "effectHit": 100, "effectResistance": 0 }, "verification": "observed-public" },
    { "id": "roberta", "name": "Roberta", "title": "Orbital Search Team", "rarity": "SSR", "element": "star", "class": "striker", "stats": { "hp": 4325, "attack": 1082, "defense": 195, "speed": 100, "criticalHitRate": 5, "criticalDamage": 50, "effectHit": 100, "effectResistance": 0 }, "verification": "observed-public" },
    { "id": "lugh", "name": "Lugh", "title": "Orbital Search Team", "rarity": "SSR", "element": "moon", "class": "ranger", "stats": { "hp": 4080, "attack": 1023, "defense": 195, "speed": 104, "criticalHitRate": 5, "criticalDamage": 50, "effectHit": 116, "effectResistance": 0 }, "verification": "observed-public" },
    { "id": "fei", "name": "Fei", "title": "Wanderer", "rarity": "SSR", "element": "moon", "class": "assassin", "stats": { "hp": 3920, "attack": 1134, "defense": 190, "speed": 90, "criticalHitRate": 5, "criticalDamage": 50, "effectHit": 100, "effectResistance": 12 }, "verification": "observed-public" },
    { "id": "epindel-house-orlan", "name": "Epindel", "title": "House Orlan", "rarity": "SSR", "element": "moon", "class": "assassin", "stats": { "hp": 3920, "attack": 1073, "defense": 190, "speed": 90, "criticalHitRate": 14, "criticalDamage": 50, "effectHit": 100, "effectResistance": 12 }, "verification": "observed-public" },
    { "id": "omega", "name": "Omega", "title": "Voyager Savior Party", "rarity": "SSR", "element": "star", "class": "caster", "stats": { "hp": 4155, "attack": 1073, "defense": 190, "speed": 96, "criticalHitRate": 5, "criticalDamage": 50, "effectHit": 100, "effectResistance": 0 }, "verification": "observed-public" },
    { "id": "charlotte-heart-of-monastir", "name": "Charlotte", "title": "Heart of Monastir", "rarity": "SSR", "element": "sun", "class": "assassin", "stats": { "hp": 3920, "attack": 1073, "defense": 190, "speed": 90, "criticalHitRate": 17, "criticalDamage": 62, "effectHit": 100, "effectResistance": 0 }, "verification": "observed-public" },
    { "id": "ceres", "name": "Ceres", "title": "Western Liberators", "rarity": "SSR", "element": "moon", "class": "striker", "stats": { "hp": 4080, "attack": 1043, "defense": 195, "speed": 106, "criticalHitRate": 5, "criticalDamage": 50, "effectHit": 108, "effectResistance": 0 }, "verification": "observed-public" },
    { "id": "lydia", "name": "Lydia", "title": "Western Liberators", "rarity": "SSR", "element": "chaos", "class": "ranger", "stats": { "hp": 4853, "attack": 917, "defense": 196, "speed": 107, "criticalHitRate": 5, "criticalDamage": 50, "effectHit": 116, "effectResistance": 0 }, "verification": "observed-public" },
    { "id": "professor-m", "name": "Professor M", "title": "Lampadis", "rarity": "SSR", "element": "moon", "class": "ranger", "stats": { "hp": 4080, "attack": 1043, "defense": 195, "speed": 106, "criticalHitRate": 5, "criticalDamage": 50, "effectHit": 108, "effectResistance": 0 }, "verification": "observed-public" },
    { "id": "gwen", "name": "Gwen", "title": "Lampadis", "rarity": "SSR", "element": "star", "class": "striker", "stats": { "hp": 4325, "attack": 1082, "defense": 195, "speed": 100, "criticalHitRate": 5, "criticalDamage": 50, "effectHit": 100, "effectResistance": 0 }, "verification": "observed-public" },
    { "id": "harley", "name": "Harley", "title": "Hell Saviors", "rarity": "SSR", "element": "sun", "class": "defender", "stats": { "hp": 5664, "attack": 600, "defense": 245, "speed": 99, "criticalHitRate": 5, "criticalDamage": 50, "effectHit": 100, "effectResistance": 12 }, "verification": "observed-public" },